{
  "$schema": "./registry.schema.json",
  "version": "1.0.0",
  "generated": "2024-12-11",
  "specialists": [
    {
      "name": "typescript-strict",
      "path": "specialists/typescript-strict.md",
      "description": "Use when writing TypeScript code or fixing type errors - enforces strict typing, eliminates any/unknown abuse, and ensures runtime safety through proper type guards and validation",
      "tags": ["typescript", "types", "generics", "validation", "zod"],
      "triggers": ["type error", "typescript", "any type", "generic", "zod schema"],
      "pairs_with": ["api-design", "react-patterns", "supabase-backend"],
      "layer": 1
    },
    {
      "name": "api-design",
      "path": "specialists/api-design.md",
      "description": "Use when designing REST APIs or handling HTTP endpoints - enforces consistent response envelopes, proper error codes, validation at boundaries, and rate limiting patterns",
      "tags": ["api", "rest", "endpoints", "validation", "error-handling"],
      "triggers": ["api route", "endpoint", "REST", "response format", "rate limit"],
      "pairs_with": ["typescript-strict", "supabase-backend", "auth-flow"],
      "layer": 1
    },
    {
      "name": "react-patterns",
      "path": "specialists/react-patterns.md",
      "description": "Use when building React components or debugging state/render issues - enforces proper hook usage, prevents unnecessary re-renders, and guides component composition patterns",
      "tags": ["react", "hooks", "state", "performance", "components"],
      "triggers": ["useState", "useEffect", "re-render", "component", "custom hook"],
      "pairs_with": ["server-client-boundary", "state-sync", "tailwind-ui"],
      "layer": 1
    },
    {
      "name": "supabase-backend",
      "path": "specialists/supabase-backend.md",
      "description": "Use when working with Supabase database, auth, or storage - enforces RLS policies on all tables, proper client setup, and secure data access patterns",
      "tags": ["supabase", "database", "rls", "auth", "storage", "realtime"],
      "triggers": ["supabase", "RLS", "database", "postgres", "storage bucket"],
      "pairs_with": ["nextjs-supabase-auth", "crud-builder", "realtime-sync"],
      "layer": 1
    },
    {
      "name": "nextjs-app-router",
      "path": "specialists/nextjs-app-router.md",
      "description": "Use when building Next.js 13+ applications - enforces Server Component defaults, proper client boundaries, and eliminates unnecessary \"use client\" directives",
      "tags": ["nextjs", "routing", "rsc", "layouts", "app-router"],
      "triggers": ["Next.js", "app router", "page.tsx", "layout", "route handler"],
      "pairs_with": ["server-client-boundary", "nextjs-supabase-auth", "react-patterns"],
      "layer": 1
    },
    {
      "name": "auth-flow",
      "path": "specialists/auth-flow.md",
      "description": "Use when implementing authentication flows - enforces secure email/password handling, proper session management, and prevents common auth vulnerabilities",
      "tags": ["auth", "login", "signup", "oauth", "password-reset", "session"],
      "triggers": ["login", "signup", "authentication", "password", "OAuth", "session"],
      "pairs_with": ["nextjs-supabase-auth", "supabase-backend", "security-audit"],
      "layer": 2
    },
    {
      "name": "payments-flow",
      "path": "specialists/payments-flow.md",
      "description": "Use when implementing Stripe payments - enforces webhook signature verification, server-side plan validation, and secure checkout flow patterns",
      "tags": ["payments", "stripe", "checkout", "webhooks", "subscriptions", "billing"],
      "triggers": ["Stripe", "payment", "checkout", "subscription", "webhook", "billing"],
      "pairs_with": ["api-design", "supabase-backend", "security-audit"],
      "layer": 2
    },
    {
      "name": "crud-builder",
      "path": "specialists/crud-builder.md",
      "description": "Use when building data management features - enforces validation at every boundary, proper RLS policies, and complete error handling for all CRUD operations",
      "tags": ["crud", "forms", "tables", "validation", "admin", "list-view"],
      "triggers": ["CRUD", "form", "data table", "admin panel", "list view", "create/edit"],
      "pairs_with": ["supabase-backend", "react-patterns", "typescript-strict"],
      "layer": 2
    },
    {
      "name": "file-upload",
      "path": "specialists/file-upload.md",
      "description": "Use when implementing file uploads - enforces server-side validation, proper storage bucket RLS, and secure file handling patterns",
      "tags": ["upload", "files", "storage", "images", "supabase-storage"],
      "triggers": ["file upload", "image upload", "storage", "S3", "blob"],
      "pairs_with": ["supabase-backend", "security-audit", "api-design"],
      "layer": 2
    },
    {
      "name": "security-audit",
      "path": "specialists/security-audit.md",
      "description": "Use when reviewing code for security vulnerabilities - enforces OWASP Top 10 compliance, proper input validation, secrets management, and RLS verification",
      "tags": ["security", "owasp", "validation", "rls", "secrets", "audit"],
      "triggers": ["security", "vulnerability", "OWASP", "injection", "XSS", "audit"],
      "pairs_with": ["auth-flow", "api-design", "supabase-backend"],
      "layer": 3
    },
    {
      "name": "tailwind-ui",
      "path": "specialists/tailwind-ui.md",
      "description": "Use when building UI components with Tailwind CSS - enforces consistent spacing, proper class merging, responsive patterns, and dark mode implementation",
      "tags": ["tailwind", "css", "ui", "responsive", "dark-mode", "components"],
      "triggers": ["Tailwind", "CSS", "styling", "responsive", "dark mode", "cn()"],
      "pairs_with": ["react-patterns", "brand-identity", "ux-research"],
      "layer": 1
    },
    {
      "name": "ux-research",
      "path": "specialists/ux-research.md",
      "description": "Use when designing user flows or navigation structure - enforces clear information architecture, consistent patterns, and accessibility requirements",
      "tags": ["ux", "user-flows", "wireframes", "navigation", "accessibility"],
      "triggers": ["user flow", "navigation", "wireframe", "UX", "accessibility", "user journey"],
      "pairs_with": ["copywriting", "brand-identity", "tailwind-ui"],
      "layer": 3
    },
    {
      "name": "copywriting",
      "path": "specialists/copywriting.md",
      "description": "Use when writing UI text, error messages, or marketing copy - enforces clear microcopy, action-oriented buttons, and consistent voice throughout the product",
      "tags": ["copy", "microcopy", "cta", "error-messages", "onboarding"],
      "triggers": ["button text", "error message", "copy", "CTA", "onboarding", "microcopy"],
      "pairs_with": ["ux-research", "brand-identity", "auth-flow"],
      "layer": 3
    },
    {
      "name": "realtime-sync",
      "path": "specialists/realtime-sync.md",
      "description": "Use when implementing live updates or collaborative features - enforces proper channel management, presence handling, and reconnection patterns for Supabase Realtime",
      "tags": ["realtime", "websockets", "presence", "live-updates", "collaboration"],
      "triggers": ["realtime", "live updates", "websocket", "presence", "collaboration", "subscribe"],
      "pairs_with": ["supabase-backend", "state-sync", "react-patterns"],
      "layer": 2
    },
    {
      "name": "state-sync",
      "path": "specialists/state-sync.md",
      "description": "Use when managing server state or implementing optimistic updates - enforces React Query patterns, proper cache invalidation, and separation of server vs client state",
      "tags": ["state", "react-query", "cache", "optimistic-updates", "zustand"],
      "triggers": ["React Query", "cache", "optimistic", "server state", "Zustand", "invalidate"],
      "pairs_with": ["react-patterns", "api-design", "server-client-boundary"],
      "layer": 2
    },
    {
      "name": "server-client-boundary",
      "path": "specialists/server-client-boundary.md",
      "description": "Use when deciding between Server and Client Components - enforces minimal \"use client\" usage, proper data flow, and composition patterns to avoid hydration errors",
      "tags": ["rsc", "hydration", "server-components", "client-components", "nextjs"],
      "triggers": ["use client", "Server Component", "hydration", "RSC", "client boundary"],
      "pairs_with": ["nextjs-app-router", "react-patterns", "state-sync"],
      "layer": 1
    },
    {
      "name": "ai-integration",
      "path": "specialists/ai-integration.md",
      "description": "Use when building AI features with LLMs - enforces API key security, rate limiting, token management, and proper streaming patterns with Vercel AI SDK",
      "tags": ["ai", "llm", "openai", "anthropic", "streaming", "rag", "embeddings"],
      "triggers": ["AI", "LLM", "OpenAI", "Anthropic", "streaming", "RAG", "embeddings"],
      "pairs_with": ["api-design", "supabase-backend", "payments-flow"],
      "layer": 2
    },
    {
      "name": "brand-identity",
      "path": "specialists/brand-identity.md",
      "description": "Use when setting up design systems or making visual decisions - enforces systematic color palettes, typography scales, and consistent spacing tokens",
      "tags": ["brand", "colors", "typography", "design-system", "theming"],
      "triggers": ["colors", "typography", "design system", "brand", "theme", "palette"],
      "pairs_with": ["tailwind-ui", "copywriting", "ux-research"],
      "layer": 3
    },
    {
      "name": "nextjs-supabase-auth",
      "path": "specialists/nextjs-supabase-auth.md",
      "description": "Use when implementing authentication with Next.js and Supabase - enforces proper client setup, middleware session refresh, and server-side verification patterns",